{
  "$schema": "https://forge-h2.local/schema/knowledge-catalog.schema.json",
  "project_id": "FHZ-ENTERPRISE-001",
  "catalog_version": "1.0.0",
  "source_of_truth": "knowledge/catalog.json",
  "generated_at": "2026-09-17T08:31:37Z",
  "entries": [
    {
      "knowledge_id": "KNW-INT-ISO-TC197",
      "schema_version": "1.0.0",
      "title": "ISO/TC 197 수소 기술 표준화 범위",
      "knowledge_type": "international_standard",
      "domains": [
        "hydrogen",
        "standards",
        "supply_chain"
      ],
      "jurisdictions": [
        "international"
      ],
      "languages": [
        "en",
        "ko"
      ],
      "authority_level": "T1_official_standard_or_authority",
      "source": {
        "source_kind": "official_standard",
        "publisher": "ISO",
        "url": "https://www.iso.org/files/live/sites/isoorg/files/store/en/PUB100493.pdf",
        "locator": "ISO/TC 197 overview",
        "captured_at": "2026-09-17"
      },
      "revision": "2026-09-17",
      "status": "active",
      "applies_to": {
        "agent_ids": [
          "AG-TEC-001",
          "AG-TEC-002",
          "AG-INT-004",
          "AG-INT-002"
        ],
        "roles": [
          "Hydrogen Process Lead",
          "International Standards Manager"
        ],
        "phases": [
          "hydrogen",
          "safety_permit",
          "feed_epc"
        ],
        "gates": [
          "G2",
          "G3",
          "G4"
        ]
      },
      "content": {
        "summary": "ISO/TC 197은 수소의 생산·저장·운송·측정·사용 관련 기술과 시스템의 국제 표준화 범위를 다룬다.",
        "claims": [
          {
            "claim_id": "CLM-TC197-001",
            "statement": "수소 공급망의 생산·저장·운송·사용 기준을 적용성 검토 대상으로 분류한다.",
            "locator": "ISO/TC 197 overview"
          }
        ],
        "keywords": [
          "ISO/TC 197",
          "hydrogen",
          "production",
          "storage",
          "transport",
          "use"
        ]
      },
      "verification": {
        "status": "machine_checked",
        "verified_by_role": "Data/Evidence Lead",
        "verified_at": "2026-09-17",
        "evidence_ids": [
          "EVD-ISO-TC197-001"
        ]
      },
      "access_policy": {
        "classification": "project_internal",
        "allowed_agent_categories": [
          "technical",
          "governance",
          "assurance",
          "advisory"
        ]
      },
      "extensions": {}
    },
    {
      "knowledge_id": "KNW-INT-ISO-22734-2025",
      "schema_version": "1.0.0",
      "title": "ISO 22734-1:2025 수전해 수소발생기 안전",
      "knowledge_type": "international_standard",
      "domains": [
        "hydrogen",
        "electrolysis",
        "safety"
      ],
      "jurisdictions": [
        "international"
      ],
      "languages": [
        "en"
      ],
      "authority_level": "T1_official_standard_or_authority",
      "source": {
        "source_kind": "official_standard",
        "publisher": "ISO",
        "url": "https://www.iso.org/standard/82766.html",
        "locator": "ISO 22734-1:2025 abstract",
        "captured_at": "2026-09-17"
      },
      "revision": "2025",
      "status": "active",
      "applies_to": {
        "agent_ids": [
          "AG-TEC-001",
          "AG-TEC-002",
          "AG-TEC-014",
          "AG-INT-004"
        ],
        "roles": [
          "Hydrogen Process Lead",
          "Process Safety Lead"
        ],
        "phases": [
          "hydrogen",
          "safety_permit",
          "feed_epc"
        ],
        "gates": [
          "G2",
          "G3",
          "G4"
        ]
      },
      "content": {
        "summary": "수전해를 사용하는 수소발생 시스템의 안전 요구사항을 적용성 검토 대상으로 둔다.",
        "claims": [
          {
            "claim_id": "CLM-ISO22734-001",
            "statement": "수전해 수소발생기의 설계·안전 검토에 ISO 22734-1:2025 적용성을 확인한다.",
            "locator": "Abstract"
          }
        ],
        "keywords": [
          "ISO 22734-1",
          "electrolysis",
          "hydrogen generator",
          "safety"
        ]
      },
      "verification": {
        "status": "machine_checked",
        "verified_by_role": "HSE/Regulatory Authority",
        "verified_at": "2026-09-17",
        "evidence_ids": [
          "EVD-ISO22734-001"
        ]
      },
      "access_policy": {
        "classification": "project_internal",
        "allowed_agent_categories": [
          "technical",
          "assurance",
          "governance"
        ]
      },
      "extensions": {}
    },
    {
      "knowledge_id": "KNW-INT-IEC-61511",
      "schema_version": "1.0.0",
      "title": "IEC 61511 기능안전·SIS",
      "knowledge_type": "international_standard",
      "domains": [
        "functional_safety",
        "sis",
        "icss",
        "process"
      ],
      "jurisdictions": [
        "international"
      ],
      "languages": [
        "en"
      ],
      "authority_level": "T1_official_standard_or_authority",
      "source": {
        "source_kind": "official_standard",
        "publisher": "IEC",
        "url": "https://webstore.iec.ch/en/publication/5527",
        "locator": "IEC 61511 series",
        "captured_at": "2026-09-17"
      },
      "revision": "2026 series",
      "status": "active",
      "applies_to": {
        "agent_ids": [
          "AG-TEC-008",
          "AG-TEC-014",
          "AG-TEC-019",
          "AG-INT-016"
        ],
        "roles": [
          "ICSS Lead",
          "Process Safety Lead"
        ],
        "phases": [
          "power_grid",
          "safety_permit",
          "feed_epc",
          "commissioning",
          "operations"
        ],
        "gates": [
          "G2",
          "G3",
          "G4",
          "G6",
          "G7"
        ]
      },
      "content": {
        "summary": "공정산업 안전계장시스템의 명세·설계·설치·운전·유지보수 생명주기를 검토한다.",
        "claims": [
          {
            "claim_id": "CLM-IEC61511-001",
            "statement": "SIS와 안전수명주기 검토에는 IEC 61511 적용성을 확인한다.",
            "locator": "IEC 61511 series scope"
          }
        ],
        "keywords": [
          "IEC 61511",
          "functional safety",
          "SIS",
          "SIL",
          "safety lifecycle"
        ]
      },
      "verification": {
        "status": "machine_checked",
        "verified_by_role": "AI Safety/Evaluation Lead",
        "verified_at": "2026-09-17",
        "evidence_ids": [
          "EVD-IEC61511-001"
        ]
      },
      "access_policy": {
        "classification": "project_internal",
        "allowed_agent_categories": [
          "technical",
          "assurance",
          "platform"
        ]
      },
      "extensions": {}
    },
    {
      "knowledge_id": "KNW-INT-IEC-61882",
      "schema_version": "1.0.0",
      "title": "IEC 61882 HAZOP 절차",
      "knowledge_type": "international_standard",
      "domains": [
        "hazop",
        "process_safety",
        "risk"
      ],
      "jurisdictions": [
        "international"
      ],
      "languages": [
        "en"
      ],
      "authority_level": "T1_official_standard_or_authority",
      "source": {
        "source_kind": "official_standard",
        "publisher": "IEC",
        "url": "https://webstore.iec.ch/en/publication/24321",
        "locator": "IEC 61882:2016 abstract",
        "captured_at": "2026-09-17"
      },
      "revision": "2016",
      "status": "active",
      "applies_to": {
        "agent_ids": [
          "AG-TEC-014",
          "AG-TEC-013",
          "AG-INT-016",
          "AG-HSE-001"
        ],
        "roles": [
          "Process Safety Lead",
          "Independent Safety Assessor"
        ],
        "phases": [
          "hydrogen",
          "safety_permit",
          "feed_epc",
          "commissioning"
        ],
        "gates": [
          "G2",
          "G3",
          "G4",
          "G6"
        ]
      },
      "content": {
        "summary": "Guide words를 사용한 HAZOP의 준비·검토 세션·문서화·후속조치 절차를 검토한다.",
        "claims": [
          {
            "claim_id": "CLM-IEC61882-001",
            "statement": "HAZOP의 준비·세션·결과문서·후속조치는 IEC 61882 절차를 기준으로 검토한다.",
            "locator": "Abstract"
          }
        ],
        "keywords": [
          "IEC 61882",
          "HAZOP",
          "guide words",
          "follow-up"
        ]
      },
      "verification": {
        "status": "machine_checked",
        "verified_by_role": "HSE/Regulatory Authority",
        "verified_at": "2026-09-17",
        "evidence_ids": [
          "EVD-IEC61882-001"
        ]
      },
      "access_policy": {
        "classification": "project_internal",
        "allowed_agent_categories": [
          "technical",
          "assurance",
          "governance"
        ]
      },
      "extensions": {}
    },
    {
      "knowledge_id": "KNW-INT-NFPA-2",
      "schema_version": "1.0.0",
      "title": "NFPA 2 Hydrogen Technologies Code 적용성",
      "knowledge_type": "international_standard",
      "domains": [
        "hydrogen",
        "fire",
        "explosion",
        "emergency"
      ],
      "jurisdictions": [
        "international"
      ],
      "languages": [
        "en"
      ],
      "authority_level": "T1_official_standard_or_authority",
      "source": {
        "source_kind": "official_standard",
        "publisher": "NFPA",
        "url": "https://link.nfpa.org/all-publications/2/2026",
        "locator": "2026 NFPA 2 preview",
        "captured_at": "2026-09-17"
      },
      "revision": "2026",
      "status": "active",
      "applies_to": {
        "agent_ids": [
          "AG-TEC-013",
          "AG-TEC-014",
          "AG-INT-004",
          "AG-INT-016"
        ],
        "roles": [
          "Fire & Emergency Lead",
          "HSE/Regulatory Authority"
        ],
        "phases": [
          "hydrogen",
          "safety_permit",
          "construction",
          "commissioning"
        ],
        "gates": [
          "G2",
          "G3",
          "G5",
          "G6"
        ]
      },
      "content": {